{"schemaId":"urn:limbodancer:asl:tir:schema:1.2.0","schemaVersion":"1.2.0","packageCandidate":{"domainId":"asl","packageId":"easlrb-3.10-a-e","version":"0.0.0-candidate.1"},"sourceRegistry":{"registryId":"asl-easlrb-3.10-a-e","sha256":"402d6c4e4cd2f5d77e202a6bac459aa1872609e545469b61d306eb5211e3f2fc","sourceCommit":"a3254ff1d492dbdd28483d86f5b42437b48e80d4"},"extractor":{"name":"LimboDancer.Domains.Asl.Authoring.StructuralExtractor","version":"1.3.0","configurationSha256":"08ca2d5417fe23ea87ad95575eb9ba9f76c753673653b0125d93d7e31f6b7867"},"canonicalization":{"name":"asl-tir-canonical-json","version":"1.0.0"},"createdAt":"2026-09-23T12:00:00.0000000Z","createdAtSource":"operator-supplied-reproducible-build-metadata","artifacts":[{"artifactId":"asl-tir:sha256:01e0c80cb33fdaeddc6bd49c1e04c3cc43b632210d9e804553d1d723745edfa2","artifactKind":"sourceFragment","packageCandidate":{"domainId":"asl","packageId":"easlrb-3.10-a-e","version":"0.0.0-candidate.1"},"publishedId":null,"normalizedPublishedId":null,"semanticId":null,"sourceFragments":[{"fragmentId":"asl-fragment:sha256:35fa8b5f52497ce9ffbac62062efad81a738e2b8486ad6c21473dba338803fcf","sourceId":"asl-easlrb-3.10:chapter-e","sourceSha256":"614b39baaefe491402f10b283ddef60ee205c2f62b94eb3a3e329a072e0fe7e7","contentSha256":"b3ca6df1bb018bb5e3821b0ef042f747cdaba705a47ec6c7d60f1820af2b0688","startLine":27,"endLine":27}],"dependencies":[],"origin":"extracted","formalizationStatus":"unmodeled","reviewStatus":"captured","confidence":1,"confidenceBasis":["exact-source-span"],"createdBy":{"name":"LimboDancer.Domains.Asl.Authoring.StructuralExtractor","version":"1.3.0","configurationSha256":"08ca2d5417fe23ea87ad95575eb9ba9f76c753673653b0125d93d7e31f6b7867","sourceRevision":"a3254ff1d492dbdd28483d86f5b42437b48e80d4"},"createdAt":"2026-09-23T12:00:00.0000000Z","reviewRecordRefs":[],"payload":{"fragmentKind":"heading","sourcePath":"docs/ASL/Rulebook_Markdown/06 - Chapter E - Miscellaneous.md","locator":{"startLine":27,"endLine":27,"startPage":222,"endPage":222,"headingPath":["E. MISCELLANEOUS","1. NIGHT"],"publishedElementId":null,"normalizedElementId":null},"hasFootnoteMarkers":false,"verificationStatus":"unverified"}},{"artifactId":"asl-tir:sha256:12fe6efa98977bf9de87d1ac618833d32281121915e172734b4a6ed045dfa55d","artifactKind":"sourceFragment","packageCandidate":{"domainId":"asl","packageId":"easlrb-3.10-a-e","version":"0.0.0-candidate.1"},"publishedId":null,"normalizedPublishedId":null,"semanticId":null,"sourceFragments":[{"fragmentId":"asl-fragment:sha256:796a44ed35ecab405e61d408fd12aca7ce34bc40811013bf7cf5046f8ec84e32","sourceId":"asl-easlrb-3.10:contents","sourceSha256":"dbe6b4395accd117d6c4a84796c11983243399cae5838c2a27abea1f4c7c59f9","contentSha256":"6a82c6742f21a85def351c4c13998028ee1a8830d7efaef3c353f2dcb8f9a88e","startLine":9,"endLine":23}],"dependencies":[],"origin":"extracted","formalizationStatus":"unmodeled","reviewStatus":"captured","confidence":1,"confidenceBasis":["exact-source-span"],"createdBy":{"name":"LimboDancer.Domains.Asl.Authoring.StructuralExtractor","version":"1.3.0","configurationSha256":"08ca2d5417fe23ea87ad95575eb9ba9f76c753673653b0125d93d7e31f6b7867","sourceRevision":"a3254ff1d492dbdd28483d86f5b42437b48e80d4"},"createdAt":"2026-09-23T12:00:00.0000000Z","reviewRecordRefs":[],"payload":{"fragmentKind":"structuredText","sourcePath":"docs/ASL/Rulebook_Markdown/00 - Table of Contents.md","locator":{"startLine":9,"endLine":23,"startPage":6,"endPage":6,"headingPath":["A. INFANTRY AND OTHER BASIC GAME RULES"],"publishedElementId":null,"normalizedElementId":null},"hasFootnoteMarkers":false,"verificationStatus":"unverified"}},{"artifactId":"asl-tir:sha256:130691dbdbdece2894d03eee4cc3ad8009d8bf8e8649aa8384005292114136a3","artifactKind":"sourceFragment","packageCandidate":{"domainId":"asl","packageId":"easlrb-3.10-a-e","version":"0.0.0-candidate.1"},"publishedId":null,"normalizedPublishedId":null,"semanticId":null,"sourceFragments":[{"fragmentId":"asl-fragment:sha256:4dc9c4fad88efea27dea5b8d3b86153a5007263323b2dfe702e5c99b3844d1fe","sourceId":"asl-easlrb-3.10:contents","sourceSha256":"dbe6b4395accd117d6c4a84796c11983243399cae5838c2a27abea1f4c7c59f9","contentSha256":"bf3d3c293de1a42d84f0ba27bb6e24614af47e0604c0d7e1d77f94889f9c28fe","startLine":3,"endLine":3}],"dependencies":[],"origin":"extracted","formalizationStatus":"unmodeled","reviewStatus":"captured","confidence":1,"confidenceBasis":["exact-source-span"],"createdBy":{"name":"LimboDancer.Domains.Asl.Authoring.StructuralExtractor","version":"1.3.0","configurationSha256":"08ca2d5417fe23ea87ad95575eb9ba9f76c753673653b0125d93d7e31f6b7867","sourceRevision":"a3254ff1d492dbdd28483d86f5b42437b48e80d4"},"createdAt":"2026-09-23T12:00:00.0000000Z","reviewRecordRefs":[],"payload":{"fragmentKind":"paragraph","sourcePath":"docs/ASL/Rulebook_Markdown/00 - Table of Contents.md","locator":{"startLine":3,"endLine":3,"startPage":6,"endPage":6,"headingPath":[],"publishedElementId":null,"normalizedElementId":null},"hasFootnoteMarkers":false,"verificationStatus":"unverified"}},{"artifactId":"asl-tir:sha256:1ac7a5a143b999785c9c6ff9f556453739e513d2575a3a3719825a353dffc34f","artifactKind":"sourceFragment","packageCandidate":{"domainId":"asl","packageId":"easlrb-3.10-a-e","version":"0.0.0-candidate.1"},"publishedId":"B.1","normalizedPublishedId":"B.1","semanticId":null,"sourceFragments":[{"fragmentId":"asl-fragment:sha256:ebc4ba8b8f1119ef656a2bbdacf29919a921203a9fd61c0cfc7074a3399d69f9","sourceId":"asl-easlrb-3.10:chapter-b","sourceSha256":"836b1ce5f845efd1c21250a9e6a39e4054ea9398f370305bc3771b6e7f826982","contentSha256":"82d3348624e9431fcdca5159e529ae09d21dde81bf8864be45ddf2ec0d7e4795","startLine":30,"endLine":30}],"dependencies":[{"kind":"figure","target":"docs/ASL/Rulebook_Markdown/images/eASLRB_v3_01-p112-2.png"}],"origin":"extracted","formalizationStatus":"unmodeled","reviewStatus":"captured","confidence":1,"confidenceBasis":["exact-source-span"],"createdBy":{"name":"LimboDancer.Domains.Asl.Authoring.StructuralExtractor","version":"1.3.0","configurationSha256":"08ca2d5417fe23ea87ad95575eb9ba9f76c753673653b0125d93d7e31f6b7867","sourceRevision":"a3254ff1d492dbdd28483d86f5b42437b48e80d4"},"createdAt":"2026-09-23T12:00:00.0000000Z","reviewRecordRefs":[],"payload":{"fragmentKind":"figureReference","sourcePath":"docs/ASL/Rulebook_Markdown/03 - Chapter B - Terrain.md","locator":{"startLine":30,"endLine":30,"startPage":112,"endPage":112,"headingPath":["B. TERRAIN"],"publishedElementId":"B.1","normalizedElementId":"B.1"},"hasFootnoteMarkers":false,"verificationStatus":"unverified"}},{"artifactId":"asl-tir:sha256:1f63b17cf8c665778dc80d440c71156fc7cbf05d56712e9c8eb94078b7c39c6d","artifactKind":"rule","packageCandidate":{"domainId":"asl","packageId":"easlrb-3.10-a-e","version":"0.0.0-candidate.1"},"publishedId":"1.13","normalizedPublishedId":"B1.13","semanticId":null,"sourceFragments":[{"fragmentId":"asl-fragment:sha256:50f711bfa7540bdec715cac06e6dc833de6c73bdaed4a494dff7efe6b84fb6e5","sourceId":"asl-easlrb-3.10:chapter-b","sourceSha256":"836b1ce5f845efd1c21250a9e6a39e4054ea9398f370305bc3771b6e7f826982","contentSha256":"335ae3bc3793d6c1fdf4f158f6f20db8253d081b1684dfab5be0b2b1b0f774fa","startLine":72,"endLine":72}],"dependencies":[],"origin":"extracted","formalizationStatus":"unmodeled","reviewStatus":"captured","confidence":1,"confidenceBasis":["chapter-local-identifier-normalized","exact-published-identifier-match"],"createdBy":{"name":"LimboDancer.Domains.Asl.Authoring.StructuralExtractor","version":"1.3.0","configurationSha256":"08ca2d5417fe23ea87ad95575eb9ba9f76c753673653b0125d93d7e31f6b7867","sourceRevision":"a3254ff1d492dbdd28483d86f5b42437b48e80d4"},"createdAt":"2026-09-23T12:00:00.0000000Z","reviewRecordRefs":[],"payload":{"directParentArtifactId":"asl-tir:sha256:bec2e344eb2a9edb7caf1f0f792d2e90c6a056683180cc9061271d7c278151c3","hierarchyStatus":"supported","hierarchyBasis":["chapterContext","publishedIdentifier"],"siblingOrder":2}},{"artifactId":"asl-tir:sha256:254afb329eeedcf7582f0d7319731976d6deee407130b7a3707611cbeb4d72b2","artifactKind":"sourceFragment","packageCandidate":{"domainId":"asl","packageId":"easlrb-3.10-a-e","version":"0.0.0-candidate.1"},"publishedId":"2.5","normalizedPublishedId":"D2.5","semanticId":null,"sourceFragments":[{"fragmentId":"asl-fragment:sha256:c814a57f8b35606631bf6e9f4eecbbe963affa5260fd3de88bd86c17e5acea08","sourceId":"asl-easlrb-3.10:chapter-d","sourceSha256":"0324892377aa710961892034c960d718854055c0f936cb3cbc8dbc938bf10c36","contentSha256":"70d72946ccda456ee56707e7babd8a78d62ad8b9a6b47522725462f36545de67","startLine":307,"endLine":313}],"dependencies":[],"origin":"extracted","formalizationStatus":"unmodeled","reviewStatus":"captured","confidence":1,"confidenceBasis":["exact-source-span"],"createdBy":{"name":"LimboDancer.Domains.Asl.Authoring.StructuralExtractor","version":"1.3.0","configurationSha256":"08ca2d5417fe23ea87ad95575eb9ba9f76c753673653b0125d93d7e31f6b7867","sourceRevision":"a3254ff1d492dbdd28483d86f5b42437b48e80d4"},"createdAt":"2026-09-23T12:00:00.0000000Z","reviewRecordRefs":[],"payload":{"fragmentKind":"structuredText","sourcePath":"docs/ASL/Rulebook_Markdown/05 - Chapter D - Vehicles.md","locator":{"startLine":307,"endLine":313,"startPage":198,"endPage":198,"headingPath":["D. VEHICLES","2. VEHICULAR MOVEMENT","2.1","2.18","2.401"],"publishedElementId":"2.5","normalizedElementId":"D2.5"},"hasFootnoteMarkers":false,"verificationStatus":"unverified"}},{"artifactId":"asl-tir:sha256:256bc94411d42c7375b79fcea20c89ae87882659249430d8954ee15d4cda3112","artifactKind":"sourceFragment","packageCandidate":{"domainId":"asl","packageId":"easlrb-3.10-a-e","version":"0.0.0-candidate.1"},"publishedId":"A.12","normalizedPublishedId":"A.12","semanticId":null,"sourceFragments":[{"fragmentId":"asl-fragment:sha256:f608d6d1ca9db7c303a18b8539db3eb1a82a65ed737b18680794a6c27884d99c","sourceId":"asl-easlrb-3.10:chapter-a","sourceSha256":"6347534e64f739cacc57dd75c3d604997723fd0b4988565609deeff007a8843d","co